{
	"schema_version": 1,
	"name": "rewards",
	"theme": "dark_fantasy",
	"viewport": {
		"width": 147,
		"height": 169,
		"scale_mode": "fit"
	},
	"theme_overrides": {
		"tokens": {
			"font_size": {
				"micro": 9,
				"caption": 10,
				"body": 11,
				"heading": 13,
				"title": 20
			},
			"material": {
				"window_tint": "#ffffff38"
			},
			"atlas": {
				"ink_cbb68a": "#cbb68a",
				"ink_d9d4c6": "#d9d4c6"
			}
		},
		"styles": {
			"atlas_text_panel": {
				"background": "#080d10",
				"border": "#756344",
				"border_width": 1,
				"radius": 1,
				"content_margin": {
					"left": 3,
					"top": 2,
					"right": 3,
					"bottom": 2
				}
			},
			"atlas_line": {
				"background": "#507084",
				"border": "#507084",
				"border_width": 0
			},
			"tab": {
				"background": "#0a1014",
				"border": "#424540",
				"border_width": 1,
				"radius": 1,
				"content_margin": {
					"left": 4,
					"right": 4,
					"top": 2,
					"bottom": 2
				},
				"font_color": "#d9d4c6",
				"hover_background": "#203441",
				"hover_border": "#a08a5e",
				"pressed_background": "#152b39",
				"pressed_border": "#cbb68a"
			},
			"list_row": {
				"background": "#0a1014",
				"border": "#424540",
				"border_width": 1,
				"radius": 1,
				"content_margin": {
					"left": 4,
					"right": 4,
					"top": 2,
					"bottom": 2
				},
				"font_color": "#d9d4c6",
				"hover_background": "#203441",
				"hover_border": "#a08a5e",
				"pressed_background": "#152b39",
				"pressed_border": "#cbb68a"
			},
			"button_primary": {
				"focus_texture": "res://examples/assets/ui/focus_ring.svg",
				"texture": "res://examples/assets/ui/button_enamel.svg",
				"hover_texture": "res://examples/assets/ui/button_hover.svg",
				"pressed_texture": "res://examples/assets/ui/button_pressed.svg",
				"disabled_texture": "res://examples/assets/ui/button_smoke.svg",
				"disabled_modulate": "#85909999",
				"texture_margin_left": 4,
				"texture_margin_right": 4,
				"texture_margin_top": 4,
				"texture_margin_bottom": 4,
				"background": "#172c39",
				"border": "$colors.border_highlight",
				"border_width": 1,
				"radius": "$radius.sm",
				"content_margin": {
					"left": 4,
					"right": 4,
					"top": 1,
					"bottom": 1
				},
				"shadow_color": "$colors.shadow",
				"shadow_size": 2,
				"hover_background": "#244253",
				"pressed_background": "#203548",
				"disabled_background": "#171c22"
			},
			"button_secondary": {
				"focus_texture": "res://examples/assets/ui/focus_ring.svg",
				"texture": "res://examples/assets/ui/button_smoke.svg",
				"hover_texture": "res://examples/assets/ui/button_hover.svg",
				"pressed_texture": "res://examples/assets/ui/button_pressed.svg",
				"disabled_modulate": "#85909999",
				"texture_margin_left": 4,
				"texture_margin_right": 4,
				"texture_margin_top": 4,
				"texture_margin_bottom": 4,
				"background": "#0b1219",
				"border": "$colors.border_muted",
				"border_width": "$border_width.hairline",
				"radius": 1,
				"content_margin": {
					"left": 4,
					"right": 4,
					"top": 1,
					"bottom": 1
				},
				"hover_background": "#263b4e",
				"pressed_background": "#172532",
				"disabled_background": "#10151b"
			},
			"atlas_orb": {
				"background": "#0c1620",
				"border": "#756a51",
				"border_width": 1,
				"radius": 18,
				"content_margin": {
					"left": 0,
					"right": 0,
					"top": 0,
					"bottom": 0
				},
				"hover_background": "#1b3e59",
				"hover_border": "#d8c590",
				"pressed_background": "#184c77"
			},
			"atlas_orb_active": {
				"background": "#123956",
				"border": "#acd8ff",
				"border_width": 1,
				"radius": 18,
				"content_margin": {
					"left": 0,
					"right": 0,
					"top": 0,
					"bottom": 0
				},
				"hover_background": "#1b3e59",
				"hover_border": "#d8c590",
				"pressed_background": "#184c77",
				"shadow_color": "#499def80",
				"shadow_size": 4
			}
		}
	},
	"metadata": {
		"preview_mode": "populated",
		"template_title": "Loot / rewards summary",
		"runtime_note": "Illustrative preview values; bind actions and data in the game layer."
	},
	"root": {
		"id": "rewards_window",
		"type": "WindowFrame",
		"layout": {
			"position": [
				0,
				0
			],
			"size": [
				147,
				169
			]
		},
		"children": [
			{
				"id": "rewards_title",
				"type": "Label",
				"layout": {
					"position": [
						16,
						8
					],
					"size": [
						92,
						23
					],
					"mouse_filter": 2
				},
				"properties": {
					"text": "Loot / Rewards",
					"font_size": 11,
					"font": "res://examples/assets/fonts/DejaVuSerifCondensed.ttf",
					"color": "$atlas.ink_cbb68a",
					"clip_text": true
				}
			},
			{
				"id": "rewards_rule",
				"type": "Separator",
				"layout": {
					"position": [
						12,
						34
					],
					"size": [
						123,
						1
					]
				}
			},
			{
				"id": "reward_portrait",
				"type": "Texture",
				"layout": {
					"position": [
						12,
						36
					],
					"size": [
						47,
						74
					],
					"mouse_filter": 2
				},
				"properties": {
					"texture": "res://examples/assets/atlas/knight.png",
					"ignore_texture_size": true,
					"stretch_mode": 6,
					"texture_region": [
						180,
						0,
						620,
						720
					]
				}
			},
			{
				"id": "reward_identity",
				"type": "Label",
				"layout": {
					"position": [
						66,
						42
					],
					"size": [
						72,
						60
					],
					"mouse_filter": 2
				},
				"properties": {
					"text": "Kael\nLevel 60\nPathfinder",
					"font_size": 10,
					"font": "res://examples/assets/fonts/DejaVuSerifCondensed.ttf",
					"color": "$atlas.ink_d9d4c6",
					"clip_text": true
				}
			},
			{
				"id": "reward_totals",
				"type": "Label",
				"layout": {
					"position": [
						12,
						114
					],
					"size": [
						125,
						30
					],
					"mouse_filter": 2
				},
				"properties": {
					"text": "Total Power      1,483\nAchievements    2,940",
					"font_size": 9,
					"font": "res://examples/assets/fonts/DejaVuSerifCondensed.ttf",
					"color": "$atlas.ink_d9d4c6",
					"clip_text": true
				}
			},
			{
				"id": "reward_emblem",
				"type": "Texture",
				"layout": {
					"position": [
						60,
						144
					],
					"size": [
						20,
						20
					],
					"mouse_filter": 2
				},
				"properties": {
					"texture": "res://examples/assets/atlas/items.png",
					"ignore_texture_size": true,
					"stretch_mode": 5,
					"texture_region": [
						1086,
						724,
						362,
						362
					]
				}
			}
		]
	}
}
